id,body,title,url,newspaper_uid,host,n_valid_tokens title,n_valid_tokens body
4d6ebf7e48e78396960a8d49e74073ca,"Mientras compraba refacciones automotrices, un presunto expolicía de investigación (PDI) del Estado de México fue asesinado a tiros; los balazos alcanzaron a un hombre que lo atendía ayer en la alcaldía Azcapotzalco.El homicidio ocurrió en la refaccionaria con razón social “Vallejo”, ubicada en el 416-A de la avenida Vallejo esquina con Calle 13, en la colonia El Porvenir.Según los reportes policiales, poco antes del mediodía el hombre —de unos 57 años— acudió al sitio en busca de refacciones para un vehículo suyo.Abren fuegoHasta ese sitio, sujetos en motocicleta lo alcanzaron y le dispararon de forma directa mientras dialogaba con el dependiente. Una de las balas lo impactó en la cabeza, mientras que su interlocutor cayó herido con un balazo en el pecho. Tras el ataque, los agresores escaparon del lugar.Familiares del difunto acudieron a reconocerlo y aseguraron que el hombre hace apenas un año se jubiló como comandante de la Policía de Investigación de la FGJEM en Ecatepec.Por esta razón, las autoridades sospechan que el crimen podría estar relacionado con sus actividades como agente; sin embargo, serán las investigaciones de la Fiscalía capitalina las que permitan resolver el caso. El agente del MP inició una carpeta de investigación.EL DATOLa Fiscalía de Justicia de la CDMX será la encargada de resolver el homicidio, que podría estar relacionado con sus actividades como agente en la Policía de Investigación en Ecatepec.",motosicarios matan expolicia del edomex mientras compraba refacciones en azcapotzalco,https://www.elgrafico.mx/la-roja/motosicarios-matan-expolicia-del-edomex-mientras-compraba-refacciones-en-azcapotzalco,eluniversal,www.elgrafico.mx,8,108
230e521d8b7df00ab258af25d3b08045,"A Pablo “No es el hombre crítico el que importa; ni el que se fija en los tropiezos del hombre fuerte o en qué ocasiones el hacedor de andanzas podía haberlo hecho mejor”.“El mérito pertenece al hombre que está en el ruedo, con el rostro estropeado por el polvo, el sudor y la sangre; al que lucha valientemente; al que se equivoca; al que fracasa una y otra vez, porque no hay intento sin error ni fallo; al que realmente se esfuerza por actuar; al que siente grandes entusiasmos; grandes devociones; al que se entrega a una causa digna; al que, en el mejor de los casos, acaba por conocer el triunfo inherente a un gran logro, y del que, en el peor de los casos, si fracasa, al menos habrá fracasado tras haberse atrevido a arriesgarse con todas sus fuerzas…”El anterior es un fragmento del discurso que Theodore Roosevelt dio en La Sorbona de París, el 23 de abril de 1910, conocido como “El hombre en el ruedo”. Y es precisamente este fragmento el que lo hizo famoso.La dignidad interiorQué sabias son las palabras de Roosevelt. Hay maneras de vivir y maneras de vivir. Hay quien se arriesga y se lanza al ruedo y hay quienes prefieren ver la vida cómodamente sentados. Estos últimos son los críticos, los que juzgan sin mancharse la cara.Desde el momento en que nos levantamos hasta que nos acostamos somos maestros de vida. Si bien es cierto que creemos conocer a las personas durante los eventos de la vida cotidiana, el conocimiento real, auténtico y profundo se nos revela ante su conducta dentro del ruedo, es decir frente a los retos y la adversidad. No hay duda.Cuánto admiro a las personas que frente a una prueba tan grande como es una enfermedad seria, por ejemplo, en lugar de la queja, eligen la aceptación, la dignidad y la sonrisa, ante la admiración de quienes las observamos. Ese tipo de dignidad interior lo podemos encontrar también en el campesino que a diario se levanta para trabajar la tierra, o en la madre soltera que día a día se parte en diez con entereza y alegría.La dignidad hace resonar esas fibras internas no negociables que vibran ante una situación límite. La dignidad interior –el secreto de muchos a quienes admiramos– es la que nos hace lanzarnos al ruedo, luchar y enfrentar cualquier reto con la cara en alto.Hay quienes nacen con esta fortaleza y son capaces de mantener la compostura de manera natural ante desafíos importantes; otros cuya fe los mantiene de pie y aquellos que se definen por la resiliencia, la determinación y la voluntad de poder.La dignidad interior se gana y nos eleva a planos en los que los elementos de nuestra vida toman otra perspectiva y otro camino, nos brinda posibilidades de transformación real.Si bien todos tenemos una dosis de dignidad, ésta se tiene que ejercitar en los momentos en que la existencia parece estar acomodada, para aferrarnos a ella cuando la vida nos lance al ruedo sin previo aviso y nos toque vivir situaciones en las que el estrés, los desengaños, las decepciones o la enfermedad nos tambaleen. Cuando los retos de la vida aparecen es el momento menos adecuado para aprender a lidiar con ellos.La dignidad no es algo que se pone y se quita, se vive. Es por eso que conviene buscar el silencio, la respiración profunda y el contacto con nuestro interior para crear una rutina que fortalezca el espíritu.Recuerda: “No es el hombre crítico el que importa… El mérito es del hombre que está en el ruedo…” y “del que se atrevió a arriesgarse con todas sus fuerzas […] eso es lo que ante los ojos del mundo y de sí mismo lo vuelve digno”. ",Salir al ruedo con dignidad,https://www.eluniversal.com.mx/opinion/gaby-vargas/salir-al-ruedo-con-dignidad,eluniversal,www.eluniversal.com.mx,3,266
b69683d437b4cea2848cae6aa2945b53,"Entre 5 y 15% de las empresas industriales de Querétaro están en riesgo de desaparecer por la crisis económica que dejó la pandemia del Covid-19, dijo el presidente local de la Cámara Nacional de la Industria de la Transformación (Canacintra), Jorge Rivadeneyra Díaz.“Estamos viendo cómo las podemos salvar, aún es tiempo y, por ello, no podemos parar otra vez, eso sí será lamentable”. dijo.Agregó que “en Querétaro existen las condiciones para la reactivación económica, aquí estamos viendo un gran esfuerzo de los gobiernos, liderados por el estado, que ha hecho muy buen trabajo, ha cuidado aspectos que hoy son fundamentales como la seguridad, las finanzas, la salud, que hoy es un tema fundamental, los hospitales no están rebasados y, bueno, tenemos que arrancar, no podemos permitirnos frenar otra vez”.Aunque comentó que siguen pidiendo que se hagan otros apoyos más importantes, “los apoyos en Alemania o en Estados Unidos, por ejemplo, son más agresivos que en México en cuestiones del PIB, pero aquí en Querétaro ya estamos empezando a ver un gran esfuerzo, recientemente tuvimos una reunión con el gobernador Francisco Domínguez y el titular de Sedesu, Marco del Prete, y ahorita Nafin ha hecho un apoyo importante a través de las gestiones del gobierno del estado, créditos muy importantes para las empresas, me parece que en todos los giros, no solamente el industrial”.Dijo que hay dos temas que los ocupan, el cuidado de la salud en la pandemia, “entonces es fundamental que nos cuidemos entre todos, en la industria hemos adoptado protocolos, francamente el mérito es de los trabajadores, de los supervisores, todos los que hacemos industria o fábrica estamos trabajando en el protocolo, esto es un tema colectivo, con mucho esfuerzo, con mucho rigor, y la gente no se está contagiando en las fábricas, y es algo que tenemos que seguir priorizando”.Añadió que otro tema, es que “estamos en un reto económico tremendo, porque ya vimos los datos de la caída del PIB (Producto Interno Bruto), “es una caída impresionante, sin precedente en la historia a nivel nacional, entonces debemos hacer una proeza para reactivar la economía; Querétaro tiene todo para reactivar la economía, es de los mejores porque tenemos gente educada, gente capacitada, la academia está, el gobierno ha hecho un muy buen trabajo, tenemos que arrancar”.Dijo que ser parte del bloque más importante del mundo con el T-MEC es fundamental para México. “Estados Unidos está haciendo esfuerzos enormes por reactivar su economía, ellos tienen mucho margen de maniobra, y eso, lo mencionó el Presidente [Andrés Manuel López Obrador], nos debe arrastrar a nosotros”.","Hasta 15% de las industrias podrían cerrar, alerta Canacintra",https://www.eluniversalqueretaro.mx/portada/entre-5-y-15-de-las-industrias-podrian-cerrar-canacintra,eluniversal,www.eluniversalqueretaro.mx,5,196
498b0f4c2e3ae3ef17eecf1ff9c66bed,"Antiguamente, el término hacienda se utilizaba en referencia a un conjunto de bienes (de ahí lo de Secretaría de Hacienda), y por eso, durante los primeros años de la colonia española en México, las llamadas haciendas eran en realidad estancias asignadas a los encomenderos (personas que tenía asignados a cierto número de indígenas) españoles, destinadas a trabajarse para obtener beneficios económicos.Lee más: Museos ofrecen actividades en línea para los niños este verano.Durante el siglo XVII, las estancias fueron creciendo en extensión y número a lo largo de todo el país. En Yucatán, su actividad primordial era la producción de ganado, pero durante el siglo XIX, muchas de estas haciendas, especialmente las cercanas a Mérida, se transformaron en henequeneras, cuando el cultivo del agave se consolidó, después de la Guerra de Castas.(Foto: Cortesía.)El esplendor del oro verdeEl henequén, llamado el oro verde, creó un escenario completamente nuevo. Esta es una planta del género de los agaves, originaria del estado de Yucatán, donde fue cultivada por los mayas en la época prehispánica. Llamada ki en maya, proliferó en esta época debido a la utilidad de sus fibras, especialmente para la fabricación de sogas y cordeles.Su exitoso comercial trajo gran prosperidad a la zona y a sus haciendas. Su producción era adquirida sobre todo por cordelerías estadounidenses, que usaban las sogas para amarrar las pacas de paja, entre otros múltiples usos, lo que trajo muchos dólares al país.Esta riqueza se expresaba en la casa principal, donde vivía el hacendado; en la casa de máquinas, donde se llevaba a cabo la parte más industrial de la producción del henequén; en la iglesia o capilla, que formaba parte de la casa principal; y hasta en las casas de los trabajadores, modernas también, de mampostería y teja. Estas haciendas, generalmente, comprendían enormes extensiones de terreno.La producción y comercio del henequén generaron tantas ganancias, que prácticamente paralizaron otras actividades productivas en el estado y Yucatán se convirtió en escenario de gran progreso y esplendor, como aún lo atestiguan las antiguas y señoriales mansiones del Paseo Montejo, en Mérida, muchas de las cuales pertenecían a estos ricos hacendados.Existían cerca de 1,000 haciendas henequeneras y de todas ellas, 850 contaban con sus propias plantas desfibradoras y empacadoras. Estas productivas propiedades estaban en manos de unas 400 familias. Las 20 o 30 más poderosas constituyeron la famosa casta divina, apodo que incluso las mismas familias adoptaron. Las haciendas henequeneras crecieron y se llenaron de lujo y comodidades.Pero, a mediados de 1940, cuando se inventaron los hilos sintéticos, la industria del henequén cayó en picada y con ella, las haciendas.(Fotos: Cortesía.)XcanatúnPor fortuna, algunos cascos de haciendas condenados a convertirse en escombros, han podido recobrar su auge y esplendor, al ser adquiridos por personas y empresas que, invirtiendo en su restauración, las han convertido en hoteles, restaurantes, paradores de lujo, museos, casas de campo y recreo o en centros destinados a eventos sociales.Preservando los detalles arquitectónicos que la caracterizaron durante su época de bonanza económica —gracias al comercio del henequén—, la Hacienda Xcanatún se ha transformado en un atractivo hotel y restaurante.Está ubicada a solo ocho kilómetros de Mérida; para llegar al lugar hay que tomar la carretera Mérida-Progreso y doblar, a la altura del Parque de Industrias No Contaminantes, en un desvío hacia el noreste que comunica con el poblado de Xcanatún.Aunque los datos históricos sobre la hacienda son escasos, se sabe que la finca comenzó a edificarse a principios de 1800, y que durante la década de los veinte fungió como estancia ganadera, propiedad de Manuel Zapata Martínez, y después pasó, de una generación a otra, como herencia familiar.Actualmente, el grupo asiático de hospitalidad de lujo, Banyan Tree Hotels & Resorts, anunció el lanzamiento de su tercera propiedad en México: Hacienda Xcanatún, la cual operará a través de su marca de lujo, Angsana.La hacienda no solo está ubicada a solo 15 minutos del centro de Mérida, sino que está a 10 minutos de la zona arqueológica de Dzibilchaltún y a 20 minutos de las playas de Puerto Progreso.(Foto: Cortesía.) Chic y tradicionalLa renovación de la Hacienda Xcanatún, es una reinterpretación contemporánea de las legendarias haciendas henequeneras. “México es la puerta al turismo de lujo del continente americano, por lo que debíamos tomar la oportunidad de renovar una propiedad como ésta. Hacienda Xcanatún es la primera propiedad de Angsana en el país y estamos orgullosos de traer la marca a un paraíso como es la península de Yucatán.”, dijo al respecto del lanzamiento Peter Hechler, director regional de Operaciones para el Medio Oriente, Europa, África del Norte y América de la marca.Con un estilo local, histórico y chic con la inspiración clásica yucateca, el hotel conserva la estructura original del espacio, pero incorpora elementos modernos de construcción y decoración.Ahora se presenta como un espacio actual, con la filosofía del lujo despreocupado, y busca aprovechar la cercanía con sitios atractivos de la península yucateca.El hotel tiene 18 suites renovadas con un diseño interior creado por el despacho mexicano Estudio 240; el restaurante Casa de Piedra, dirigido por la renombrada chef Paloma Ponce; y el Spa by Ansagna, que conserva la tradición asiática. El spa ofrece tratamientos de inspiración oriental con aromaterapia, uso de ingredientes naturales y técnicas premiadas a nivel mundial.Lee más: Lugares de Nayarit que recomienda visitar la chef Betty Vázquez.(Foto: Cortesía.)El restaurante insignia tiene una cocina que se basa en los orígenes de la región, con ingredientes locales, inspirada en la técnica francesa con acentos y toques mexicanos.Ahí se ofrecen desde clases de cocina, hasta otro tipo de actividades gastronómicas y de maridaje, diseñadas especialmente para huéspedes y pensadas para tener un mayor vínculo con la historia e identidad gastronómicas del estado.La Hacienda Xcanatún forma parte de la Comisaría Meridiana de Xcanatún y sostendrá varios proyectos de inclusión y colaboración comunitaria. A su vez, la propiedad busca conservar la flora y fauna naturales de su entorno; en su jardín hay iguanas, ardillas, coatimundis, garzas y aves muy diversas.(Foto: Cortesía.)La renovada propiedad abrió sus puertas el 1° de julio, de acuerdo con las indicaciones de seguridad sanitaria del gobierno federal y estatal, y con la aplicación global de su programa estrella Santuario Seguro, con la aplicación de más de 40 protocolos, procedimientos y medidas preventivas que cubren las necesidades derivadas a la situación sanitaria actual, con el fin de asegurar el bienestar de todos los huéspedes que visiten sus espacios.","En Yucatán, duerme en una antigua hacienda transformada en hotel de lujo",https://www.eluniversal.com.mx/destinos/en-yucatan-duerme-en-una-hacienda-transformada-en-hotel-de-lujo,eluniversal,www.eluniversal.com.mx,7,548
e931cc8ced99aca8e52fc9ddfe2e8391," 0 % PULSO SOCIAL0 Ya sea que lo conozcas como Khal Drogo o como Acuamán, lo cierto es que Jason Momoa se ha convertido en uno de los rostros más conocidos del mundo de la ciencia ficción del cine y la TV actual.Pero hace unos cuantos años el actor no tenía una complexión tan musculosa y se paseaba por las playas de Hawái en un conocido programa sobre salvavidas…Jason Momoa nació en Hawái el 1 de agosto de 1979, pero creció en Iowa, Estados Unidos, donde fue criado por su madre. En la preparatoria regresó a su estado natal para estudiar, no obstante, sus planes cambiaron cuando fue descubierto por Takeo Kobayashi, un diseñador de modas internacional.Así fue como Momoa se inició en el mundo del modelaje y gracias a su buen físico, las ofertas no le faltaron. En 1999 se convirtió en el Modelo del Año en Hawái y participó en una pasarela para Louis Vuitton. En De10.mx te contamos todo acerca de la carrera de Jason Momoa y cómo pasó de ser un chico anónimo a una sensación televisiva. Hoy, en el cumpleaños #41 del actor ¡conoce todos los detalles!Jason Momoa en Baywatch/Jason Momoa posando para su Instagram en 2016 (Foto: GTG Entertainment Pearson All-American Television The Baywatch Company Tower 12 Productions /Instagram @prideofgypsies) Ese mismo año fue escogido para integrarse al elenco del popular programa televisivo Baywatch (Guardianes de la Bahía), venciendo a otros mil actores que audicionaron. Momoa obtuvo el rol de Jason Joane, al que dio vida por varias temporadas. Después de esta gran oportunidad, Momoa decidió tomarse un tiempo y viajar por el mundo. Visitó varios países, entre ellos el Tibet, donde descubrió el budismo.Jason Momoa: 10 cualidades del hombre más salvaje del mundoTras este descanso, Jason Momoa se mudó a Los Ángeles para dedicarse de lleno al mundo del espectáculo. Lo vimos en Baywatch: Hawaiian Wedding (2003) y Tempted (2003), ambas cintas para la pantalla chica.También participó en North Shore, una serie corta de sólo veinte episodios. Finalmente, llegó una nueva gran oportunidad para el actor con Stargate Atlantis, donde interpretó a Ronan Dex.El personaje se hizo conocido en la comunidad de fans de la ciencia ficción. Pero durante la filmación de esta serie, Jason Momoa se vio involucrado en una pelea en un bar de Los Ángeles, que le dejó como resultado su característica cicatriz en la ceja. Jason Momoa en Baywatch/Jason Momoa posando para su Instagram en 2016 (Foto: GTG Entertainment Pearson All-American Television The Baywatch Company Tower 12 Productions e Instagram @prideofgypsies) Finalmente llegó el 2011 y con este, el papel de Khal Drogo en Game of Thrones. Aunque Drogo era una persona de pocas palabras, las habilidades físicas de Momoa y su atractivo lo hicieron uno de los personajes más populares de la serie.Tras su salida de Juego de Tronos, Momoa obtuvo otro protagónico, esta vez en la serie Frontier. También se convirtió en un superhéroe, al dar vida a Acuamán, primero con cameos en Batman v Superman: Dawn of Justice (2016) y Justice League (2017) y finalmente con una película en solitario en 2018.En noviembre del año pasado estrenó su nueva serie, See, a través de Apple TV. En ella, da vida a un jefe guerrero que busca un futuro en un mundo distópico donde la humanidad ha perdido el sentido de la vista.Además de su status de estrella de Hollywood, Momoa está comprometido con el medio ambiente. En 2019 lanzó su propia línea de agua enlatada, remarcando la importancia de abandonar el plástico y reemplazarlo por materiales reciclables.La vida personal de Jason MomoaJason se “casó” con la actriz Lisa Bonet en 2007, aunque su matrimonio no fue una ceremonia oficial. Su unión se formalizó legalmente en 2017. La pareja tuvo dos hijos, Lola Iolani Momoa y Nakoa-Wolf Manakauapo Namakaeha Momoa.Además Jason tiene una relación muy cercana con Zoë Isabella, la hija que Lisa tiene de su matrimonio previo con el cantante Lenny Kravitz.La diferencia de edad entre Jason y Lisa, que tiene 52 años ha sido motivo de especulación en los tabloides. De hecho, el propio Momoa confesó que estaba enamorado de Bonet desde los ocho años, cuando la vio como Denise Huxtable en The Cosby Show.VIDEO: ",el antes y despues de jason momoa nuestro salvaje favorito,https://de10.com.mx/top-10/el-antes-y-despues-de-jason-momoa-nuestro-salvaje-favorito,eluniversal,de10.com.mx,5,355
a6ba5ee3fe4cc07d59841d50913c0cd0,"Es lugar común asegurar que las grandes crisis también pueden ser “ventanas de oportunidad”. Sin embargo, y a propósito de la pandemia de Covid-19, Sheri Berman —politóloga de la Universidad de Columbia— advierte que ese potencial transformador puede perderse, (“Crisis only sometimes lead to change. Here’s why”, Foreign Policy Magazine, verano de 2020).Desde una perspectiva progresista, Berman examina la crisis política europea de 1848 cuando estalló una ola de rechazo al orden establecido por las monarquías conservadoras que habían derrotado a Napoleón. Las revueltas de la época mostraron que en varios países se había acumulado el descontento contra el empeño restaurador del absolutismo. Sin embargo, las divisiones entre los sectores insatisfechos —clases medias liberales, proletariado inspirado por el socialismo y nacionalismos separatistas—, impidieron que los esfuerzos insurgentes pudieran aglutinarse alrededor de un proyecto de reformas con metas comunes mínimas y al final las fuerzas conservadoras prevalecieron.En el siglo XX, Berman ve al período entre las dos guerras mundiales como otra crisis que pudo haber cambiado al mundo en un sentido progresista pero que, por el contrario, la capitalizó la derecha y desembocó en una catástrofe descomunal. En contraste, a partir de 1945 la Guerra Fría propagó en Occidente variantes del modelo rooseveltiano (el “New Deal”) e impulsó la unificación europea. En los 1970 ese capitalismo keynesiano hizo crisis en el momento en que dos líderes conservadores, Ronald Reagan y Margaret Thatcher, pudieron hacer realidad el corpus de ideas neoliberales ya muy desarrolladas por economistas como los de la escuela de Chicago. El posterior hundimiento de la URSS reafirmó la fuerza de ese proyecto.Según el planteamiento anterior, la crisis de la economía globalizada de 2007-2009 aunada a los duros efectos económicos y sociales de la pandemia causada por el SARS-CoV-2, más el ambiente de inconformidad generado por las movilizaciones anti racistas en EU y otros países, abren la posibilidad de un nuevo “momento rooseveltiano” que podría desembocar en la superación del neoliberalismo y de su impresionante empeño por disminuir las capacidades del Estado en favor del mercado y en aumentar las desigualdades sociales al concentrar la riqueza de manera brutal: hoy la fortuna personal de Jeff Bezos, de Amazon, sobrepasa los 180 mil millones de dólares, mientras que sus empresas niegan a sus trabajadores el derecho a sindicalizarse y a modificar el ritmo de trabajo despiadado que se les exige.La tesis de las crisis como oportunidad para el cambio puede ser útil para interpretar no sólo coyunturas mundiales sino nacionales o incluso locales. En el caso mexicano, la tensión acumulada por los cambios cardenistas llevó a una crisis a la que poco le faltó para desembocar en un levantamiento armado (el almazanista). Montada en esa atmósfera, en la coyuntura de la 2ª Guerra Mundial y luego en la Guerra Fría, la derecha demolió el proyecto cardenista. La crisis electoral provocada por el henriquismo de 1952 ya no llevó a ningún cambio significativo y la normalidad autoritaria posterior se mantuvo pese a la crisis de 1968 y la posterior “guerra sucia”. Ambas coyunturas las aprovechó el propio sistema para montar un gran acto de gatopardismo: reformar el subsistema electoral para soltar presión sin modificar la esencia del conjunto.El fraude electoral de 1988 fue otro momento de crisis que volvió a ser bien aprovechado por la derecha: bajo el liderazgo de Carlos Salinas se abjuró del modelo “nacionalista” de industrialización protegida, se desmanteló mucho del aparato productivo del estado (y en el proceso se dio vuelo la corrupción, como en Rusia), se abrazó con entusiasmo la doctrina neoliberal y la fusión de la economía moderna mexicana con la norteamericana. En el proceso de cambio, el viejo partido de estado —el PRI— debió pagar un precio: una pérdida paulatina pero irreversible de poder y tuvo que cogobernar con su antiguo rival de derecha: el PAN.Hoy, una izquierda moderada, encabezada por un líder carismático —Andrés Manuel López Obrador— puede aprovechar la crisis local y global del neoliberalismo para impulsar un modelo de sociedad diferente. Y avanzaría más rápido en esa dirección si logra dar forma más acabada a las vías para alcanzar lo que propone como meta: una sociedad más equilibrada, un sistema político con la corrupción bajo control y un Estado capaz de garantizar la impartición de justicia, los servicios de salud universales, la educación pública de calidad, un ingreso mínimo general y poner fin a la inseguridad. La posibilidad existe.[email protected]",El incierto destino de las crisis,https://www.eluniversal.com.mx/opinion/lorenzo-meyer/el-incierto-destino-de-las-crisis,eluniversal,www.eluniversal.com.mx,3,385
