id,body,title,url,newspaper_uid,host,n_valid_tokens title,n_valid_tokens body
03c01985b6c1dfa9be605a538ee9062d,"La cantante Rihanna irradió belleza durante la fiesta virtual que realizó para celebrar el lanzamiento de su nueva línea de productos para el cuidado de la piel, Fenty Skin.Decidió realizar la fiesta de esa manera para no exponer a sus invitados a posibles contagios de Covid-19, pero tampoco quiso que pasara desapercibida la ocasión.Deslumbró ataviada con un vestido de cuero ceñido a su silueta. La prenda tenía una arriesgada abertura que dejó a la vista casi toda su pierna izquierda. Lució su espalda descubierta y completó su look con con zapatillas a juego, pertenecientes a su nueva colaboración con Amina Muaddi.     Ver esta publicación en Instagram           Una publicación compartida por FENTY SKIN (@fentyskin) el 30 de Jul de 2020 a las 7:13 PDTRihanna demostró sus dotes de modelo al posar para la cámara. Destacó su rostro maquillado con productos Fenty Beauty: base, labial rojo, sombras doradas, rubor bronceado y amplias pestañas negras. Sumó más de 3 millones de reacciones con la publicación, en la que cientos de sus seguidores la felicitaron por su nuevo éxito en la industria de la belleza.     Ver esta publicación en Instagram           Una publicación compartida por badgalriri (@badgalriri) el 30 de Jul de 2020 a las 6:57 PDTLa incursión de Rihanna en el negocio de la moda y belleza le ha resultado en una fortuna de $600 millones de dólares, de acuerdo con información de la revista Forbes. Es la cantante más rica del mundo, por delante de Madonna ($ 570 millones), Céline Dion ($ 450 millones) y Beyoncé ($ 400 millones).“Fenty Beauty acumuló ventas reportadas de $ 100 millones de dólares en sus primeras semanas, impulsadas por la fama de Rihanna y 81 millones de seguidores de Instagram”, señalan. El imperio Fenty de Rihanna se expande con Fenty Skin. Tiene a la venta espumas, jabones, lociones, astringentes y cremas hidratantes para la cara y el cuerpo. Rihanna se ha alejado de la industria musical, pero promete volver con fuerza. En una entrevista con Entertainment Tonight, aseguró que ha estado trabajando en nuevas canciones todo este tiempo y que los fans no estarán decepcionados con el resultado.  “Siempre estoy trabajando en la música. Cuando esté lista de la manera que quiero, saldrá. Y no te decepcionará cuando suceda. Ha tardado tanto, voy a hacer que valga la pena”, dijo sobre el que será su noveno álbum de estudio.     Ver esta publicación en Instagram           Una publicación compartida por badgalriri (@badgalriri) el 19 de Abr de 2020 a las 4:57 PDTRihanna saltó a la escena musical con su primer single Pon De Replay hace 15 años. Por ahora, pide a sus seguidores darle una oportunidad a sus productos Fenty Skin. “Hacer [Fenty Skin] fue un desafío porque sentía la responsabilidad de cubrir todas las bases y pensar en los muchos tipos de piel que existen. Pero ustedes saben que amo un buen desafío. Queremos que estos productos funcionen para todo tipo de piel y, por supuesto, para todos los tonos de piel. Quiero que estas cosas sean diferentes de cualquier otra que esté en el mercado. Quiero que sea simple. Quiero que sea accesible, pero aún con alto nivel de ingredientes”, agregó.     Ver esta publicación en Instagram           Una publicación compartida por FENTY SKIN (@fentyskin) el 27 de Jul de 2020 a las 4:42 PDTMira las fotos de Rihanna en la galería. ",rihanna luce su vestido de cuero backless mas arriesgado,https://www.viveusa.mx/showbiz/rihanna-luce-su-vestido-de-cuero-backless-mas-arriesgado,eluniversal,www.viveusa.mx,7,273
fd4bfc534a8cb06a62a62712964ee00b,"La Asociación de Gobernadores de Acción Nacional (GOAN) expresó su reconocimiento a las Fuerzas Federales y Estatales por haber logrado la detención de José Antonio Yépez Ortíz, alias “El Marro”, principal líder del Cártel de Santa Rosa de Lima.Es un logro para Guanajuato y para el país, expusieron al felicitar especialmente al gobernador de Guanajuato, Diego Sinhue Rodríguez Vallejo, por su trabajo para capturar esta madrugada a ese presunto criminal.A través de su cuenta en Twitter, la GOAN señaló que la captura, ocurrida en Apaseo El Alto, Guanajuato, donde también se logró la captura de 5 personas más y la liberación de una empresaria que se encontraba secuestrada, es un logro para el estado de Guanajuato y para todo México. Felicitamos a nuestro compañero @diegosinhue por su trabajo para capturar al Marro esta madrugada. Nuestro reconocimiento también a fuerzas federales y estatales que participaron en su captura. Un logro para #Guanajuato y el país. — Asociación de Gobernadores de Acción Nacional (@GOAN_MX) August 2, 2020grg","Detención de “El Marro”, un logro para el país: GOAN",https://www.eluniversal.com.mx/nacion/detencion-de-el-marro-un-logro-para-el-pais-goan,eluniversal,www.eluniversal.com.mx,5,81
cd5a525124b2273f3c5b5e1bf0a588b0,"San José.— El Museo de Arte de El Salvador, que nació en 2003 en época de posguerra civil y se convirtió en una estación de referencia de la cultura de Centroamérica, resistió durante más de 17 años a un entorno de violencia criminal, pero cedió ante un inesperado enemigo: el coronavirus.Aunque permaneció a salvo de los ataques de la pandillas o maras Salvatrucha y 18, de redes del narcotráfico, así como de escuadrones clandestinos y sobrevivió a un contexto de muerte y sangre, el museo cerró el 19 de marzo pasado por culpa de la pandemia.“Esperamos que sea temporal, pero la situación financiera es muy difícil (...) Deseamos regresar en 2021. Cerramos las salas presenciales por el resto de 2020 y suspendimos las actividades grupales, como talleres, conferencias y conciertos.“Estamos construyendo una plataforma digital, con publicaciones, investigación artística y obras de arte”, dice la salvadoreña Eugenia Lindo, directora ejecutiva del museo a EL UNIVERSAL.Sin ingresos por donaciones, patrocinios y otrosEn un golpe en cadena por el efecto colateral de la enfermedad y la paralización general económica por la cuarentena en El Salvador, el museo perdió el ingreso de recursos por cooperación externa, donaciones privadas, alquiler de espacios, patrocinios de actividades, ventas y otras tareas comerciales y sus finanzas entraron en severa crisis.“Ahora ya tenemos un poco más claro lo que significan una cuarentena y un parón económico, pero en marzo lo ignorábamos y su impacto era imprevisible. No lo dimensionábamos, no éramos capaces de cuáles eran las consecuencias de esto y creo que todavía nos cuesta racionalizarlo.“Hay que hacer una gran inversión para reacondicionar a los museos con normas de bioseguridad y pensando en conservar las obras de arte, con protocolos para los visitantes entre muchas otras medidas. Es un gasto enorme”, advirtió.OscuridadTras la noche de la guerra salvadoreña, de 1980 a 1992, que abrió un hoyo sociopolítico de rencores, El Salvador cayó en un precipicio de violencia criminal y de inseguridad a partir de 1993, por las deportaciones masivas de salvadoreños desde Estados Unidos, en especial de mareros.En un país sumido en la zozobra posbélica de la reconciliación, el museo emergió en la capital salvadoreña como ente privado sin fines de lucro, abrió brecha y avanzó a transformarse en referente cultural, pero clausuró puertas por el Covid-19... hasta nuevo aviso.Frente al ataque del virus, ya cerrado y al liquidar a 13 de sus 19 empleados, el museo envió a los seis restantes al teletrabajo y empezó a buscar la reducción de costos y a desarrollar servicios para ofrecer a futuro un acceso a su acervo por vía digital para “sociabilizarlo y visibilizarlo”.“La lección es una: no podemos seguir dejando a la cultura como lujo o última prioridad ni tener que decir: ‘O invierto en salud o en todo lo otro’. Y todo es importante por su función social, como la cultura, que está en precario y es una de las más susceptibles a estas situaciones graves”, indicó. ",El Salvador: museo resistió a entorno violento... no al virus,https://www.eluniversal.com.mx/mundo/el-salvador-museo-resistio-entorno-violento-no-al-virus,eluniversal,www.eluniversal.com.mx,6,224
af07a450bd79b7cb285b3745404a0a73,"El embajador de Estados Unidos en México, Christopher Landau, celebró la captura de José Antonio Yépez, “El Marro”, líder del Cártel de Santa Rosa de Lima, ocurrida esta madrugada en Guanajuato.“Excelente noticia para comenzar este día domingo: la captura del delincuente “El Marro” en Guanajuato. Los delincuentes se creen tan vivos y tan listos, pero al final siempre vamos a ganar los buenos. ¡Viva el estado de derecho!”, publicó a través de su cuenta de Twitter.La detención fue confirmada por el gobernador de Guanajuato, Diego Sinhue Rodríguez Vallejo, y por el titular de la Secretaría de Seguridad y Protección Ciudadana (SSPC), Alfonso Durazo, quienes agregaron que fue puesto a disposición de un juez local debido a que en la captura fue liberada una mujer víctima de secuestro.El secretario Durazo informó que, una vez cumplidas las formalidades jurídicas ante las autoridades locales, será trasladado al penal federal Altiplano para cumplimentar la orden de aprehensión librada en su contra por un juez federal por robo de hidrocarburos y delincuencia organizada.Lea también: Detienen a “El Marro” en GuanajuatoEl pasado mes de junio, su mamá fue detenida junto con otros familiares en Guanajuato, por ello, El Marro apareció en un vídeo en el que amenazó a las autoridades federales y del estado con desatar la violencia en la entidad.Días después su mamá fue liberada porque un juez local declaró ilegal su detención. Excelente noticia para comenzar este día domingo: la captura del delincuente El Marro en Guanajuato. Los delincuentes se creen tan vivos y tan listos pero al final siempre vamos a ganar los buenos. ¡Viva el estado de derecho! pic.twitter.com/ZGrXkylA6z — Embajador Christopher Landau (@USAmbMex) August 2, 2020grg ",Embajador de EU celebra captura de “El Marro”,https://www.eluniversal.com.mx/nacion/embajador-de-eu-celebra-captura-de-el-marro,eluniversal,www.eluniversal.com.mx,5,144
6c8c71ca9637a6445822e7f21d00d836,"Su ascenso como uno de los grupos de tráfico de drogas más poderosos del país causó que entre los integrantes del Cártel Jalisco Nueva Generación (CJNG) buscarán arrebatarle a Nemesio Oseguera Cervantes 'El Mencho' su liderazgo.Las traiciones que sufrió el criminal causaron un incremento en la violencia del país, en varias entidades donde existía paz vieron de repente como sus calles se tiñeron de sangre y su población temía por su vida.Uno de los aliados del Mencho comenzó a financiar a nuevas células para que desde su sede desestabilizarán a la organización criminal, Ismael 'El Mayo' Zambada', jefe del Cártel de Sinaloa, se dice que está apoyando a organizaciones delictivas en entidades como Guanajuato y Michoacán para parar al conocido como 'Señor de los gallos'.Uno de los primeros en traicionar al Mencho fue  Carlos Enrique Sánchez, 'El Cholo' quien está identificado como una de las cabezas del Cártel Nueva Plaza, grupo delictivo que disputa el control del tráfico de drogas a sus ex compañeros.Tras la desaparición y supuesto homicidio de tres estudiantes de cine a manos de sicarios del Mencho, las autoridades ventilaron la pugna entre 'El Cholo' y 'El Mencho' al asegurar que los jóvenes fueron confundidos como integrantes de la organización de la Nueva Plaza.Además, aceptaron que a Carlos lo detuvieron en tres ocasiones, pero por falta de pruebas quedó en libertad y los jueces jamás explicaron los motivos para soltar a tan peligroso criminal.Otro de los supuestos jefes del grupo antagónico del Mencho es Diego Gabriel Mejía, quien fue arrestado con otros cuatro hombres: el colombiano Brayan Hernán Almario; Miguel Ángel Goche Fernández; Hugo Israel Palomera y José Jonathan Cárdenas Sánchez. La policía también aseguró armamento y dos vehículos.Una traición más dolorosa parece ser la de Miguel Fernández, alias el M2, quien tenía como tarea principal exterminar al grupo rival identificado como 'Los Viagras' o 'La Nueva Familia Michoacana'.'El M2' era la clave para terminar pronto la guerra en Michoacán y con su traición parece que la batalla podría ser perdida por las huestes del Mencho.Aunque el narco que más odia el Mencho es Juan José Farías Álvarez, 'El Abuelo' quien presuntamente es una de las cabezas que mantiene una cruenta guerra en Michoacán.'El Abuelo destacó que las tres veces que fue detenido nunca se le comprobó algún delito y mostró con pruebas su inocencia.El propio gobernador de Michoacán, Silvano Aureoles, acusa a Farías Álvarez de encabezar una organización criminal y trata de disfrazarlo con la supuesta defensa de Tepalcatepec.Por redes sociales se difundió una serie de mensajes donde 'El Mencho' ofrece una recompensa millonaria a quien logre capturar al Abuelo, a quien acusa de traidor.Las semanas posteriores varios integrantes del CJNG se trasladaron hasta el municipio michoacano para tratar de matar a Farías Álvarez, gracias a los comunitarios, policías municipales y estatales se evitó la caída de Tepalcatepec.El pasatiempo preferido del ‘Mencho’",Las traiciones que sufrió 'El Mencho',http://www.unionjalisco.mx/articulo/2020/07/seguridad/las-traiciones-que-sufrio-el-mencho,eluniversal,www.unionjalisco.mx,3,251
397f7b133c2983a8c2eeeb3489f2d346,"Debe entenderse como un simple escarceo, un clásico round de sombra, el ríspido intercambio de señalamientos surgido en la semana recién terminada entre un bloque de gobernadores (10, que resultaron ser nueve) y Hugo López-Gatell. En ambos frentes se sabe que apenas vienen las etapas más duras de la verdadera batalla.El subsecretario de Salud, responsable y vocero de la estrategia contra la pandemia, encara un creciente desgaste ante evidencias de que al cierre del año —cercano al segundo aniversario del gobierno López Obrador— podríamos alcanzar 100 mil muertes por Covid-19 y ubicarnos entre los países con peores resultados frente a la emergencia sanitaria.Se diría que el peso específico de López Gatell se encaminará cada vez más hacia la irrelevancia, pero Palacio Nacional tiene reservada para él otra hoja ruta, que en muchas de sus estaciones lo hará chocar con los gobernadores, apuntalado por su principal promotora: Raquel Buenrostro, titular del SAT.A López Gatell ya le construyeron su tabla de salvamento. Tendrá nuevas tareas, entre ellas supervisar al nuevo organismo público que comprará en el extranjero y distribuirá los medicamentos destinados al sector público de la salud, un mercado cuyo valor se estima por encima de los 100 mil millones de pesos anuales.Esta nueva entidad en ciernes, cuya dirección le fue confiada a David León (exvocero del gobierno de Chiapas bajo Manuel Velasco, excoordinador de giras presidenciales al inicio de la administración y extitular de Protección Civil), se edificará sobre las ruinas de Birmex, una paraestatal planeada para fabricar vacunas, pero casi desmantelada durante el gobierno pasado. Insólitamente, la 4T puso a cargo de la misma a Carlos Rello, estrechamente identificado con el controvertido exgobernador mexiquense Arturo Montiel, padre político de Enrique Peña Nieto.El proyecto de una comercializadora de medicamentos ya le había sido encomendado al inicio de la administración a la citada Buenrostro, entonces oficial mayor de la Secretaría de Hacienda, quien acumuló más yerros que logros en el propósito de desplazar a farmacéuticas, nacionales e internacionales, así como a distribuidoras. Todas ellas fueron acusadas de corrupción, sin que haya habido mayores acciones judiciales o administrativas contra ninguna, salvo en el caso del político y farmacéutico jalisciense Carlos Lomelí, aliado de AMLO. Una vez que sus empresas fueron saciadas con contratos públicos, según se ha difundido, resultaron “penalizadas” por la secretaria de la Función Pública, Irma Eréndira Sandoval.Buenrostro chocó en su momento con todos los titulares del sector salud, lo que llevó a Germán Martínez a presentar su renuncia al IMSS, y a Jorge Alcocer, de Salud, a reclamar el respaldo de Palacio Nacional. La estrategia debilitó ciertamente a monopolios y topó con algunos corruptos, pero se descubrió que muchos de ellos están dentro de las propias instituciones públicas. El mayor efecto colateral fue agudizar la escasez de medicinas, que ha empezado a mostrarse nuevamente de manera descarnada.Los que vienen no deberían ser tiempos de porros ni de rudos, sino de ajedrecistas. Al menos hasta que se cumpla la cita con las urnas en el 2021.Apuntes:El procesamiento penal de “Billy” Álvarez y de su primer círculo de colaboradores en la cooperativa Cruz Azul tuvo entre las motivaciones gubernamentales acercarse al vínculo entre una casta dorada de abogados y altos funcionarios del pasado sexenio. Uno de ellos, Ángel Martín Junquera Sepúlveda, ya figura en la lista de imputados en el caso de la cementera. Se le responsabiliza de una burda ingeniería jurídica para justificar el flujo de facturas falsas de empresas fantasma, a cuyo frente aparecen algunos de estos abogados o sus parientes cercanos. Apenas comienzan a tirar del hilo de esa madeja *** Las autoridades mexicanas parecen empeñadas en bajar el perfil de los señalamientos sobre el exsecretario de Gobernación, Miguel Ángel Osorio Chong, actual coordinador del PRI en el Senado. Pero su círculo cercano en Hidalgo está en llamas. Es el caso de los empresarios Carlos Sosa Velasco y Carlos Tapias Vargas, quienes, según fuentes consultadas, pueden saltar a la atención nacional en el futuro próximo.[email protected]",López-Gatell y las batallas que vienen,https://www.eluniversal.com.mx/opinion/roberto-rock-l/lopez-gatell-y-las-batallas-que-vienen,eluniversal,www.eluniversal.com.mx,2,354
36817aba52945952989928676dc2ad60,"El operativo en el que fue detenido José Antonio Yépez Ortiz, “El Marro”, líder del cártel de Santa Rosa de Lima, en Guanajuato, dejó un total de nueve detenidos, entre ellos el jefe de seguridad de la organización, informó la Secretaría de la Defensa Nacional (Sedena).Mediante un comunicado la dependencia detalló que la detención de “El Marro” ocurrió al ejecutar una orden de cateo en dos inmuebles ubicados en el municipio de Santa Cruz de Juventino Rosas, Guanajuato, donde los integrantes de la organización fueron ubicados como resultado de actividades de inteligencia.La Sedena apuntó que la ejecución de las órdenes de cateo fue realizada en coordinación con la Fiscalía General del Estado de Guanajuato.En uno de los inmuebles cateados se encontraba “El Marro” en compañía de Salud Sergio N, “Cebollo”, identificado como jefe de seguridad de Yépez Ortiz y cuatro integrantes más del Cártel.Lea también: ""El Marro”, el líder huachicolero que declaró la guerra al CJNGAhí fueron aseguradas cinco armas largas, tres armas cortas, un lanzagranadas, una camioneta tipo pick up, un cuatrimoto, una motocicleta y una maleta con dinero en efectivo, pendiente de confirmar la cantidad.En ese mismo inmueble fue localizada una mujer que fue identificada por el gobernador de Guanajuato, Diego Sinhue Rodríguez Vallejo, como una empresaria que permanecía secuestrada por la organización.En el otro inmueble fueron detenidas tres personas más, una de ellas que ya contaba con orden de aprehensión, a quienes les aseguraron 36 mil 400 pesos.De acuerdo con el Secretario de Seguridad y Protección Ciudadana, Alfonso Durazo, los detenidos fueron puestos a disposición de las autoridades judiciales locales y una vez que se cumplan las formalidades jurídicas, “El Marro” será trasladado al penal federal del Altiplano donde un juez de este fuero libró orden de aprehensión en su contra por delincuencia organizada y robo de hidrocarburos.grg ",Sedena reporta 9 detenidos en operativo de captura de “El Marro”,https://www.eluniversal.com.mx/nacion/sedena-reporta-9-detenidos-en-operativo-de-captura-de-el-marro,eluniversal,www.eluniversal.com.mx,6,151
35c669015e530a9ba30e00c980e79ff1,"La cifra de muertos por Covid-19 registrada en los últimos 4 meses, periodo que lleva la pandemia, es equivalente al número de homicidios cometidos en Querétaro durante los casi tres últimos años.La Secretaría de Salud estatal (Seseq) reportó que hasta el 30 de julio se tenían acumulados un total de 500 muertos, cuya causa de fallecimiento se da por padecer esta enfermedad.Mientras que el número de homicidios registrados en los últimos 34 meses (casi en los últimos tres años) también llega a 500, revela información del Secretariado Ejecutivo del Sistema Nacional de Seguridad Pública (SESNSP).De acuerdo a los datos de Martina Pérez Rangel, titular de la dirección de los Servicios de Salud de la Seseq, Querétaro presenta una tasa de letalidad del 13% por Covid-19.Del total de las 500 defunciones reportadas, Pérez Rendón detalló que 337 (67%) son casos que se registraron en hombres y 163 (33%) en mujeres.Agregó que las personas de mayor edad son la que más fallecen a causa del coronavirus: “el grupo de 60 a 64 años de edad aporta el 18.8%, mientras que el grupo de 65 años en adelante el 46.7%. Entre ambos grupo se concentra el 65.5% de las muertes, es decir más de la mitad de los fallecimientos”.Asimismo, la funcionaria destacó que la hipertensión es la principal causa de fallecimiento en los pacientes de Covid-19, con 47.4%; mientras que la diabetes aporta el 39.2%; el tabaquismo (9.8%) y la insuficiencia renal (7%). Algunos de los decesos presentaron más de uno de estos padecimientos, dijo.Baja tasa de homicidios. Querétaro es una entidad que en promedio registra una baja tasa de homicidios por cada 100 mil habitantes. Un ejemplo es lo sucedido en junio pasado cuando el estado fue el segundo con menos incidencia, En dicho mes se registraron 0.3 homicidios por cada 100 mil habitantes, mientras que el promedio nacional llegó al 2.2. La mayores tasas se tuvieron en Chihuahua y Colima con 7.2 y 6.6, respectivamente.En el comparativo anual, junio de 2019 frente al mismo mes de 2020, Querétaro registró un descenso del 36.4% en el número de homicidios dolosos.De acuerdo a la base de datos almacenada en la plataforma de la SESNSP, de septiembre de 2017 a junio de 2020, es decir los últimos 34 meses, en Querétaro se registraron 500 homicidios, que son aquellas acciones con las cuales se le quitó la vida a una persona de manera intencional.En el periodo de septiembre a diciembre de 2017, la SESNSP contabiliza 57 homicidios; mientras que en 2018 se cometieron 180 ilícitos de este tipo; en 2019, el número ascendió a 177 y en el primer semestre de 2020 la cifra llegó a 86.En los primeros seis meses de 2020, casi el 55% (45 casos) de los homicidios que se registraron en Querétaro fueron cometidos con arma de fuego; mientras que en 20 incidentes se utilizó una arma blanca; 18, se hizo uso de otro elemento no identificado. ",Empata cifra de muertos por Covid-19 y homicidios ,https://www.eluniversalqueretaro.mx/portada/empata-cifra-de-muertos-por-covid-19-y-homicidios,eluniversal,www.eluniversalqueretaro.mx,4,211
