id,body,title,url,newspaper_uid,host,n_valid_tokens title,n_valid_tokens body
6772b2b9b6b3b22ea043c7773b26d4d7,"Canadá es considerado uno de los países con mejor calidad de vida en todo el mundo. Un ranking de US News lo coloca en la cima de la lista debido a su acceso a la alimentación, vivienda, educación, atención médica y calidad ambiental.Pero el empleo y la seguridad laboral también son factores que ayudaron al país a posicionarse. Debido a las características de su población, los empleos que más demanda Canadá están en el rubro de la tecnología y en el de los oficios. Por un lado, buscan atraer a personas con talento en TI y capacidad de innovación. Por otro, abastecer la demanda de trabajadores como soldadores y mecánicos. A continuación, las 10 ocupaciones más demandadas en Canadá en 2020, según un informe de Randstad, empresa líder en Recursos Humanos en el país. 10) Ingenieros eléctricos: Se encargan de diseñar productos y sistemas que tengan electricidad a través de ellos. Pueden ocuparse en los sectores de energía, telecomunicaciones, software y más. 9) Mecánico de servicio pesado: Reparan y dan mantenimiento a maquinaria pesada de empresas que así lo requieran. Con mayor frecuencia trabajan en manufactura, energía o construcción. Debido a que escasean estos técnicos en Canadá, los mexicanos pueden emplearse en ese país mediante las ofertas que publica el Servicio Nacional del Empleo. 8) Gerentes de proyecto: Esta posición es cada vez más relevante en industrias que van desde las telecomunicaciones y la ingeniería hasta el marketing. Randstad apunta que, en Canadá, deben contar una certificación profesional PMP. Recomendamos: ¿Se puede solicitar un permiso de trabajo en Canadá durante la pandemia?7) Obreros y trabajadores de limpieza: Canadá no solamente requiere de perfiles altamente capacitados, también emplea obreros, trabajadores de limpieza y mantenimiento en sus fábricas. Tareas que requieren de resistencia física. Si eres mexicano, puedes monitorear vacantes en la página del Servicio Nacional del Empleo. 6) Gerente de desarrollo de negocios: Son responsables de incorporar nuevos negocios y desarrollar estrategias para ayudar a los vendedores de su organización. También cierran tratos con nuevos clientes. El perfil que exigen en Canadá es altamente calificado, con especializaciones y posgrados. 5) Desarrollador de software: Tienen un amplio campo laboral en la creación de software empresarial, aplicaciones, creación de sitios web o cualquier otra cosa que se ejecute en código. Los extranjeros pueden postularse a vacantes de este tipo mediante el programa Express Entry. 4) Soldadores: Cada vez hay menos soldadores en Canadá, pero su trabajo es de suma importancia en diferentes industrias, razón por la cual están en la lista de las ocupaciones más demandadas.  Si eres mexicano, puedes monitorear vacantes en la página del Servicio Nacional del Empleo. Son frecuentes. 3) Recepcionistas: Quizá es el puesto más sorpresivo en la lista, pero Randstad asegura que las empresas canadienses buscan recepcionistas actualizadas en conocimiento de los sistemas telefónicos y los programas de computadora. Además, es importante su trato con los visitantes y clientes. 2) Conductores: Las ventas en línea y las aplicaciones han abierto un nuevo campo de trabajo para los conductores. Ya no sólo se requieren conductores para trabajar en servicios de taxi, ahora también para que sean repartidores, choferes de vehículos montacarga o comerciales. 1) Representantes de ventas: Los asociados de ventas, o representantes de ventas, son el trabajo más solicitado en Canadá en 2020. “Las empresas cuentan con vendedores talentosos para trasladar los productos de los estantes a las manos de los clientes. La capacidad de ventas innata y una personalidad extrovertida lo ayudarán a tener éxito en este campo”, señala Randstad.Lee: Buscan mecánicos mexicanos para trabajar en Canadá por $53,664",los 10 trabajos mas demandados en canada en 2020,https://www.viveusa.mx/negocios/los-10-trabajos-mas-demandados-en-canada-en-2020,eluniversal,www.viveusa.mx,4,309
fd96725aa253c186eec58846f37ea1dc,"Juchitán de Zaragoza.- Con una búsqueda intencionada con la aplicación de pruebas rápidas, el gobierno de El Espinal informó que se arrojó un total de 70 casos positivos de Covid-19 en este municipio del Istmo de Tehuantepec, aún cuando las estadísticas de los Servicios de Salud de Oaxaca (SSO) sólo reportan 12 casos positivos en tres meses.Las pruebas rápidas forman parte del Plan Municipal de Atención por Covid-19 que se implementó en el municipio para tener un panoramas real de lo que está sucediendo, pues muchos de las personas son asintomáticas, por lo que es mayor el riesgo de contagio en la comunidad; también se decidió aplicar las pruebas ante la falta de laboratorios clínicos en la población.Las  personas que salieron positivas en  las pruebas rápidas se les hizo entrega de un kit de medicamentos para su tratamiento y material preventivo, además se les recomendó el aislamiento voluntario.Este es el primer gobierno municipal que aplica pruebas rápidas a sus ciudadanos, la primer instancia pública que lo hizo fue el Hospital “General Macedonio Benítez Fuentes"" donde más de 170 trabajadores salieron positivos, lo que se considera el mayor brote de contagio en un hospital del país.Actualmente, el Istmo de Tehuantepec atraviesa una fase acelerada en los contagios de coronavirus, lo que aumentado el número de pacientes y muertes, por lo que el gobernador Alejandro Murat pidió a la población que se mantengan en confinamiento voluntario hasta el próximo 29 de julio.",Búsqueda intencionada arroja seis veces más casos de Covid-19 en El Espinal,https://oaxaca.eluniversal.com.mx/municipios/27-07-2020/busqueda-intencionada-arroja-seis-veces-mas-casos-de-covid-19-en-el-espinal,eluniversal,oaxaca.eluniversal.com.mx,7,113
1834e81eecebe6ec1b26d03af41e789a," 0 % PULSO SOCIAL0 Los índices de aprobación de las potencias mundiales han registrado algunas variaciones. De acuerdo con la encuesta anual de liderazgo global que realiza Gallup, Alemania mantiene su posición como el mejor país calificado en el mundo, por tercer año consecutivo. Aquí en De10.mx te explicamos los detalles...La encuesta se realizó el año pasado (2019) a mil personas en 135 países, es por ello por lo que no se debe perder de vista que, al elaborar el informe con datos del año pasado, no se pudo tomar en cuenta el liderazgo que cada una de las naciones tomó ante la pandemia de coronavirus.El factor de la pandemia y la respuesta que tuvieron a la crisis global Alemania, Estados Unidos, China y Rusia, podría modificar posteriormente la aprobación mundial de cada una de estas naciones. El tema del coronavirus podría afectar sobre todo a China, país en el que se originó la enfermedad y a los Estados Unidos, que anunció su retiro oficial de la Organización Mundial de la Salud. Este informe revela la manera en el que el mundo califica el liderazgo de las potencias mundiales y su gestión ante diversas crisis.Las cuatro potencias más admiradas en el mundo1. AlemaniaCon un índice de aprobación del 44%, Alemania se colocó en el primer lugar. Supera a Estados Unidos por un margen de 11 puntos porcentuales.Para Mohamed Younis, editor en jefe de Gallup, “la canciller alemana Angela Merkel ha sido una de las líderes más predecibles en tiempos altamente inciertos tanto en Europa como en el orden global establecido después de la Segunda Guerra Mundial”. MerDespués de que en 2018 Alemania cayó por debajo del 40%, la aprobación media del país se recuperó en el 2019 y logró avanzar cuatro puntos porcentuales, gracias al liderazgo de la canciller, quien es vista como la nueva Margaret Tatcher, pero dulcificada; una mujer de mano dura, pero con guante de seda.El dato que resulta llamativo es que Alemania es el país con mejor percepción, incluso en naciones en las que prácticamente no tiene incidencia. También es curioso que su aprobación, específicamente en el continente americano sea del 35%, apenas un punto por arriba de EU.La canciller alemana, Angela Merkel. (Foto: Xinhua)2. Estados UnidosDurante la administración de Barack Obama, de 2009 a 2017, Estados Unidos se mantuvo como la potencia más respetada en el mundo, con una sola excepción en 2011, cuando Alemania ocupó el primer lugar.Cuando Donald Trump asumió la presidencia de EU, la aprobación de su país cayó en picada. De tener una aprobación del 48%, pasó al mínimo histórico de 30%, una caída de 18 puntos porcentuales.Los 10 Jefes de Estado más ricos del mundoActualmente, su índice de aprobación global es de 33% y la mayoría de las opiniones negativas vienen de Europa, donde el 61% de las personas encuestadas reprueban la administración actual.Tan solo en África es donde la situación parece un poco más positiva con un 52% de aprobación hacia Estados Unidos, pero hay que recordar que cuando Obama estaba en la presidencia norteamericana, los africanos le dieron una aprobación de 85%.El presidente de EU, Donald Trump. (Foto: Xinhua)3. ChinaSu índice de aprobación global promedio del liderazgo es del 32%, casi a la par de Estados Unidos, pero su imagen cae de forma sistemática, pues es percibida como una dictadura con varias faltas en cuanto a libertad y respeto a los derechos humanos. Además, el tema sobre la pandemia por coronavirus ha generado desconfianza en esta nación y eso podría verse reflejado en la encuesta que se realice este año.4. RusiaDurante 2019 su índice de aprobación global promedio del liderazgo fue de 30%, así que no registra cambio alguno respecto a los datos analizados del 2018. Básicamente, la Rusia de Vladimir Putin es vista como “poco fiable en el ranking.VIDEO:",los 4 paises con la mejor aprobacion mas admirados en el mundo,https://de10.com.mx/cultura-digital/los-4-paises-con-la-mejor-aprobacion-mas-admirados-en-el-mundo,eluniversal,de10.com.mx,6,299
1b458acbf54dbd6dba3e45ceac398a20,"El 28 de noviembre de 2014 era un viernes casi cualquiera, la Ciudad de México vibraba con la Copa de fútbol celebrada en Brasil, ese día era aparentemente uno más, en los televisores de muchos hogares del país se veía con detenimiento el partido Filipinas contra Vietnam, mismo que sería ganado por los vietnamitas.Era alrededor de las 14:30 horas de aquel día cuando la señal de diversas televisoras se interrumpió, el balompié había dejado de ser el centro de atención para enfocarse en un suceso más importante, uno que trascendió el país y llegó a toda Latinoamérica, Estados Unidos y algunas partes de Europa; Roberto Gomez Bolaños “Chespirito” había fallecido a los 85 años en Cancún, sitio en el que el comediante se había retirado desde algunos años antes.La comedia mexicana perdió ese día a uno de sus grandes artífices, creador de “La vecindad del Chavo”, “El chapulín colorado”, “Los caquitos” y “El chancleta” por nombrar algunos.Roberto, apodado el Shakespeare mexicano había dejado ""huérfanos"" a La Chilindrina, Quico, El Chavo, El profesor Chapatín y una lista larga de personajes que creó durante sus más de seis décadas de carrera, también dejó a sus seis hijos, Roberto, Paulina, Marcela, Teresa, Graciela y Cecilia. Si viuda Florinda Meza, tras dar a  conocer el fallecimiento de su “Robert” señalaba que Chespirito no estaba muerto, que seguiría en la obra que dejó, en los recuerdos de todos aquellos fans que seguirían viendo lo que creó el comediante.Hoy se cumplen cinco años de que Chespirito tomó su última y larga siesta - tal y como lo describió Florinda este miércoles- y en ese tiempo muchas cosas han pasado con el legado de Gómez Bolaños, tanto la obra que dejó como los seres queridos que le sobreviven. Aquí un breve recuento:EMPRESA CHESPIRITOEn estos cinco años, la marca Grupo Chespirito, que se creó en 2005, se ha expandido logrando llevar a sus personajes de la vecindad a los dibujos animados que hasta a la fecha lleva 100 capítulos. Aunque al inicio esta marca estaba apoyada por Televisa, en 2017 continuó por su cuenta. Este año la marca abrirá su primer restaurante temático bajo el nombre de “Chanfle y recontrachanfle”, el cual se estrenará antes de que termine el año. Chespirito tiene posicionado más de 400 productos de sus personajes, entre juegos, ropa,  accesorios y productos escolares.También lee: Chespirito tendrá su universo de series y películas ROBERTO GÓMEZ FERNÁNDEZEl primogénito de Chespirito es el actual presidente de la marca que fundó su padre hace 14 años. Además de supervisar todas las licencias y productos de su marca también ha seguido su labor como productor donde ha hecho la adaptación de la teleserie española “Gran hotel” a la cual rebautizaron como “El hotel de los secretos” en 2016. Dos años después hizo “La jefa del campeón”, basado en “La mamá del diez”, una serie de Tv colombiana. En 2017, Roberto Gómez Fernández se casó con Krystell Padilla, su ex asistente, de 37 años, con quien llevaba tres años de relación y 2 viviendo juntos. Este es el cuarto matrimonio de Fernández. FLORINDA MEZATras la muerte de su esposo, su viuda continuó alejada de los medios, detalló que su retiro fue obligado por que ella aunque quería trabajar no le ofrecían proyectos. Fue a inicios de este 2019 cuando la actriz y productora anunció que regresaba a la actuación, pero en esta ocasión al cine en la película “Dulce familia”, en la que dio vida a Veronica Trujillos, una diva de las telenovelas. En este filme compartió lo créditos con Fernanda Castillo y Vadhir Derbez.También lee: Florinda Meza recuerda a Roberto Gómez Bolaños con video conmovedor  En octubre de 2017 y a tres años de la muerte del cómico se dijo que Florinda había encontrado el amor en un hombre más joven, esto por una foto en la que se ve a la actriz en compañía de un hombre, agarrados de la mano en Nueva York. Meza aclaró que era un fan argentino y que ella seguía enamorada de Roberto.También lee: Florinda Meza y ""La Chilindrina"" volverán a la pantalla chica  RUBÉN AGUIRREDos años después de que Chespirito murió, el Profesor Jirafales también perdió la vida. El actor murió a los 82 años en el balneario mexicano de Puerto Vallarta, Jalisco. Según dijo su hija, el actor murió por complicaciones de una neumonía. Aguirre había estado hospitalizado en mayo y le dieron de alta el pasado 7 de junio para reposar en casa. Un año antes de su muerte Ruben Aguirre había lanzado su autobiografía bajo el nombre “Después de Usted. Las memorias del profesor más querido de America Latina”. MARÍA ANTONIETA DE LAS NIEVESLuego de años de distanciamiento, la Chilindrina y Florinda Meza al parecer limaron asperezas, ya que además de que en marzo de 2019 María Antonieta dijo que ya no guardaba rencor a Chespirito y Florinda. Luego tras una larga batalla contra la neumonía su esposo Gabriel Fernández perdió la vida días después de estar internado en un hospital al sur de la Ciudad de México a lo 86 años. Días después de darse a conocer la lamentable noticia fue Florinda Meza quien le dio las condolencias a La Chilindrina. A través de su cuenta de Instagram, Meza compartió un mensaje que acompañó con una fotografía en la que aparece ella, Roberto Gómez Bolaños y María Antonieta.También lee: La Chilindrina vive enferma y endeudadaal","Chespirito: A cinco años de su partida, qué ha pasado con su legado",https://www.eluniversal.com.mx/espectaculos/television/chespirito-cinco-anos-de-su-partida-que-ha-pasado-con-su-legado,eluniversal,www.eluniversal.com.mx,6,453
11de1a4811acb9a99bc4124719b07ee6,"Enamorándonos no funcionó en su nueva temporada, duró muy poco y ni Penélope Menchaca lo levantó.El programa no funcionó en audiencia, su rating iba a la baja, con apenas poco más de 500 mil espectadores.El último programa de Enamorándonos es el 31 de julio y prevén regresar cuando cambie un poco la contingencia por coronavirus.Menchaca mencionó que la decisión pasaba porque no podía explotarse el programa como se debe. Además que el mensaje puede ser contradictorio en la pandemia.La realidad es que se unen esas dos cosas: la pandemia y el poco interés en el programa.Mala suerte de Penélope MenchacaLa conductora dejó Venga la Alegría por estar en Enamorándonos, donde sustituía a Carmen Muñoz.Previo a Venga la Alegría le cancelaron un programa a Penélope, de parejas justamente.En Mexicana Universal tampoco tuvo mucho éxito y se habla mucho de su mala suerte, pues no logra mantenerse como titular en un programa.TE PUEDE INTERESARLa mala suerte de Penélope MenchacaAl Extremo suple a Enamorándonos, cambios de horario en Azteca UNO",El fracaso de Enamorándonos y la mala suerte de Penélope Menchaca,http://www.unionyucatan.mx/articulo/2020/07/espectaculos/el-fracaso-de-enamorandonos-y-la-mala-suerte-de-penelope-menchaca,eluniversal,www.unionyucatan.mx,6,80
b26560f8f8b9aa7967abe10a6200a3d8,"Señoras y señores representantes de las benditas redes ¡pongánse truchas en las mañaneras!Como parte del exitoso programa ""Jóvenes edificando nuestro futuro"", en colaboración con la cancillería, la 4T está premiando a las filas que más aplaudan, echen porras, lleven matracas y hagan preguntas a modo para resaltar sus grandes logros contra la corrupción con el reparto de consulados de México alrededor del mundo. Se dará prioridad a quienes ocupen desde las 5 horas las primeras filas, sepan bloquear a periodistas fifís con preguntas-juramentos de amor incondicional y demuestren su preparación al haber escrito ""textos"".El jurado también tendrá consideración especial con quienes sean ""polémicos"", como la reciente ganadora del consulado mexicano en Estambul, Turquía; por ese y muchos otros méritos, fuentes diplomáticas adelantaron a El Foco que ya se alistan reformas a la Ley del Servicio Exterior para que los premios incluyan embajadas.Entre los candidatos, revelan personas cercanas al proceso, se cuentan Lord Molécula, quien podría ser galardonado con la embajada concurrente de México en Tonga y la directora de la agencia oficial de noticias del Estado, apenas se resuelva la huelga montada por un grupúsculo de periodistas conservadores, que seguramente ya perdieron sus privilegios.LAS NOCTURNAS DEL DOCTORToda soberbia tiene un límitePues resulta que nueve gobernadores del país, que representan a 30 millones de mexicanos, dijeron esto es suficiente y en una carta abierta, pidieron la renuncia del subsecretario de Salud y ""consejero"" de ya saben quién, Hugo López-Gatell; lo hacen responsable por el fracaso de la estrategia contra el Covid-19 y sus funestas consecuencias. En la misiva recalcaron que el titular de facto del sector Salud apenas y aceptó la utilidad del cubrebocas... horas antes, la Ssa los amenazó con sanciones penales, en caso de no acatar el semáforo epidemiológico federal. Sorprende cómo los fanáticos de la 4T han convertido en su héroe a un personaje que tampoco dio resultados, horror, en el último gobierno panista.¡USEN CUBREBOCAS!Los seis meses de la plagaYa pasaron seis meses de que la Organización Mundial de la Salud (OMS) lanzó su alerta de emergencia sanitaria por el coronavirus y seguimos batallando con este mal, que además de las numerosas víctimas que ha dejado asestó un golpe histórico a la economía, generando, en el caso de México, un retroceso de diez años. Es cierto, el desarrollo de vacunas está avanzando en varios países, pero hoy por hoy, todos tenemos que cuidarnos y seguir las normas mínimas de prevención. En los países que más éxito han tenido para domar el virus, como China, Nueva Zelanda, Alemania, Vietnam o Taiwán, todos usan cubrebocas y se hicieron pruebas masivas entre la población. TRUMP, EN PROBLEMAS¿Aplazar las elecciones? ¡Ni locos!Faltan menos de cien días para las elecciones generales en Estados Unidos, que renovarán la presidencia, parte del Congreso y de los gobiernos estatales, y Donald Trump está tan preocupado que incluso empezó a usar ""tapabocas"" y recomendar su empleo a la población. Hay muchos factores en su contra, que favorecen al candidato opositor Joe Biden y van por supuesto desde el pésimo manejo de la pandemia hasta el racismo y el desempleo. La sugerencia que hizo para aplazar los comicios, con la falsedad, para variar, del fraude en la votación por correo, unió por primera vez a republicanos y demócratas en el rechazo a su idea. Sin embargo, no olvidemos que las encuestas se han equivocado muchas veces y que Trump aún puede dar una sorpresa.LA FRASE""México es uno de los cinco únicos países que tienen una política exterior feminista"".Martha Delgado, subsecretaria de Relaciones Exteriores.NUMERALIA2012Año en que Suiza reportó a México movimientos millonarios sospechosos en una cuenta bancaria asociada a Gilda Susana, hermana de Emilio Lozoya Austin.2021Año en que comenzará el juicio de Ghislaine Maxwell, novia de Jeffrey Epstein, por tráfico sexual de menores.",El Foco. La Fila que más aplauda se lleva los consulados,https://www.eluniversal.com.mx/nacion/el-foco-la-fila-que-mas-aplauda-se-lleva-los-consulados,eluniversal,www.eluniversal.com.mx,5,325
f60f6606bd927a4a4e92f01bf05ed632,"La renuncia de Guillermo Álvarez Cuevas dejó dividida a La Cooperativa Cruz Azul y la reacción podría impactar al equipo de la Liga MX. La filtración de su salida afectó a la organización y al mismo club, que venía de regreso a la ciudad tras empatar con el Puebla; sin embargo, ahí no termina la historia de Billy con La Máquina. A pesar de que el directivo firmó su renuncia —oficial, comunicaron fuentes a EL UNIVERSAL Deportes—, como director general de La Cooperativa, Álvarez Cuevas no ha quedado libre de sus responsabilidades, ya que la Asamblea General, máximo instrumento dentro de la organización, debe aceptarla.Leer más: ¿Comentarista fue censurado en ESPN por hablar de prensa comprada por Cruz Azul? Estos socios, los mismos que formaron el viernes la Junta de Gobierno, no quieren dejarle las riendas a los conocidos disidentes, encabezados por José Antonio Marín Gutiérrez y Víctor Manuel Velázquez Rangel, que encabezan las Comisiones de Administración y de Vigilancia, y quienes han tenido sus diferencias como el propio Billy.Los cooperativistas se reunieron en la Ciudad de México, Oaxaca e Hidalgo, para manifestar el respaldo hacia el director general y no aceptar su salida de la organización y, por ende, del equipo.Sin embargo, todavía no existe una fecha para la Asamblea General, por lo que este proceso puede tomar semanas, y la silla del presidente del Cruz Azul, de acuerdo con la Liga MX, sigue a nombre de Guillermo Álvarez Cuevas. En noviembre del año pasado, Marín Gutiérrez y Velázquez Rangel, junto a un pequeño sector de supuestos cooperativistas, se presentaron en las instalaciones de la Federación Mexicana de Futbol, en Toluca, para presentarle una carta a Yon De Luisa, en la que solicitaron la salida de Billy de La Máquina; sin embargo,  se les impidió la entrada. Unos días después, Enrique Bonilla, presidente de la Liga MX, desconoció a este sector y respaldó a Álvarez. Ahora, todo habría cambiado en el Cruz Azul, con la entrada de este grupo, que tiene contactos con Carlos Hermosillo para encabezar su proyecto dentro de La Noria.   ",Renuncia de 'Billy' Álvarez cimbra en Cruz Azul,https://www.eluniversal.com.mx/universal-deportes/futbol/liga-mx-renuncia-de-billy-alvarez-cimbra-en-cruz-azul,eluniversal,www.eluniversal.com.mx,5,178
